{
  "spec_version": 1,
  "adapter": "claude",
  "mode": "review",
  "process": { "rc": 0, "signal": null, "timedOut": false },
  "provider": { "class": "none" },
  "verdict": { "state": "valid", "payloadRef": "https://github.com/panzi-hub/MergeMill/issues/229#issuecomment-0000" },
  "voteEligibility": { "state": "pass" }
}
